{"format":"lunarsim-scene","version":1,"scenario":"P1","mechanism":"inhouse","seed":3,"terrain":"connecting_ridge","pad_standoff_km":"1","horizon_h":8760.0,"chunk_h":720.0,"frame":"terrain pack local frame: x east, y north (m from the tile's south-west corner), z = LOLA height (m); heading: grid azimuth deg, 0 = +y, 90 = +x","sites":{"BASE":[7450.0,7510.0,1957.6],"DEPOT":[7150.0,7250.0,1937.5],"POWER":[7910.0,8070.0,1949.6],"CONSTR":[7610.0,7710.0,1953.2],"ISRU":[8610.0,7510.0,1818.5],"SCI_1":[9270.0,8630.0,1843.4],"PSR":[11170.0,8870.0,1657.8],"PAD_A":[8130.0,8210.0,1945.0],"PAD_B":[7610.0,6490.0,1879.9]},"vehicles":[{"id":0,"owner":"NASA","cls":"LTV","autonomy":"supervised","night_ops":false,"capacity_kg":1500},{"id":1,"owner":"CoA","cls":"LTV","autonomy":"supervised","night_ops":false,"capacity_kg":1500},{"id":2,"owner":"CoB","cls":"MICRO","autonomy":"teleop","night_ops":false,"capacity_kg":300}],"states":["idle","driving","loading","team_lift","parked_night","standdown","waiting_for_earth","failed"],"segment_columns":["veh","job","t0","t1","x0","y0","z0","x1","y1","z1","route","f0","f1","load_kg","state","heading_deg"],"hourly_columns":["sun_az_deg","night","earth_el_deg","earth_radius_deg","earth_bearing_deg","waiting_n_BASE","waiting_n_DEPOT","waiting_n_POWER","waiting_n_CONSTR","waiting_n_ISRU","waiting_n_SCI_1","waiting_n_PSR","waiting_n_PAD_A","waiting_n_PAD_B","waiting_kg_BASE","waiting_kg_DEPOT","waiting_kg_POWER","waiting_kg_CONSTR","waiting_kg_ISRU","waiting_kg_SCI_1","waiting_kg_PSR","waiting_kg_PAD_A","waiting_kg_PAD_B"],"route_columns":["x","y","z","f"],"routes":{"file":"routes.bin","bytes":9472,"sha256":"35ae69888b1fe73f6f4478fce2f020441772625535993558797bebf194ba6eb8","source":"data/driving/routes-v1.json (B-32), simplified (RDP, 0.5 m)","items":[{"leg":"DEPOT->CONSTR","lighting":"0","n":17,"length_m":697.4,"offset":0},{"leg":"CONSTR->BASE","lighting":"0","n":7,"length_m":266.27,"offset":272},{"leg":"BASE->CONSTR","lighting":"90","n":10,"length_m":266.27,"offset":384},{"leg":"CONSTR->BASE","lighting":"90","n":7,"length_m":266.27,"offset":544},{"leg":"BASE->CONSTR","lighting":"180","n":6,"length_m":266.27,"offset":656},{"leg":"CONSTR->BASE","lighting":"180","n":6,"length_m":266.27,"offset":752},{"leg":"BASE->CONSTR","lighting":"270","n":7,"length_m":266.27,"offset":848},{"leg":"CONSTR->BASE","lighting":"270","n":7,"length_m":266.27,"offset":960},{"leg":"BASE->CONSTR","lighting":"0","n":7,"length_m":266.27,"offset":1072},{"leg":"BASE->SCI_1","lighting":"90","n":54,"length_m":2365.93,"offset":1184},{"leg":"SCI_1->BASE","lighting":"90","n":62,"length_m":2354.21,"offset":2048},{"leg":"BASE->PAD_A@1","lighting":"90","n":23,"length_m":981.67,"offset":3040},{"leg":"PAD_A@1->BASE","lighting":"90","n":23,"length_m":981.67,"offset":3408},{"leg":"BASE->PAD_A@1","lighting":"0","n":29,"length_m":1028.53,"offset":3776},{"leg":"PAD_A@1->CONSTR","lighting":"90","n":16,"length_m":727.11,"offset":4240},{"leg":"CONSTR->PAD_A@1","lighting":"90","n":21,"length_m":727.11,"offset":4496},{"leg":"PAD_A@1->DEPOT","lighting":"90","n":29,"length_m":1389.36,"offset":4832},{"leg":"DEPOT->CONSTR","lighting":"90","n":19,"length_m":685.69,"offset":5296},{"leg":"DEPOT->PAD_A@1","lighting":"90","n":34,"length_m":1401.08,"offset":5600},{"leg":"DEPOT->PAD_A@1","lighting":"0","n":33,"length_m":1424.51,"offset":6144},{"leg":"PAD_A@1->DEPOT","lighting":"0","n":33,"length_m":1424.51,"offset":6672},{"leg":"PAD_A@1->SCI_1","lighting":"0","n":32,"length_m":1405.69,"offset":7200},{"leg":"SCI_1->PAD_A@1","lighting":"0","n":38,"length_m":1405.69,"offset":7712},{"leg":"PAD_A@1->BASE","lighting":"0","n":29,"length_m":1028.53,"offset":8320},{"leg":"BASE->DEPOT","lighting":"180","n":10,"length_m":407.7,"offset":8784},{"leg":"DEPOT->PAD_A@1","lighting":"180","n":33,"length_m":1389.36,"offset":8944}]},"chunks":[{"file":"chunk_000.bin","t0":0.0,"t1":720.0,"bytes":68416,"sha256":"809300e59bfc97e820fc75983b687fd21df0ac1689279cbf3c7ebaf36405d90f","segments":{"offset":0,"rows":34,"cols":16},"hourly":{"offset":2176,"rows":720,"cols":23,"first_hour":0}},{"file":"chunk_001.bin","t0":720.0,"t1":1440.0,"bytes":68992,"sha256":"32e3142ca18193ca74671fe5883f894020205afb6270d9667deb380cdfb8f848","segments":{"offset":0,"rows":43,"cols":16},"hourly":{"offset":2752,"rows":720,"cols":23,"first_hour":720}},{"file":"chunk_002.bin","t0":1440.0,"t1":2160.0,"bytes":68672,"sha256":"ff3daed50a291efc90fca523388d74dd5f6b5b6d8f310da97c38466b5e32c366","segments":{"offset":0,"rows":38,"cols":16},"hourly":{"offset":2432,"rows":720,"cols":23,"first_hour":1440}},{"file":"chunk_003.bin","t0":2160.0,"t1":2880.0,"bytes":68416,"sha256":"985c3f93d03cb4c000c9e108a99ea70ea30dbc78cf20461966563a81ad3348dd","segments":{"offset":0,"rows":34,"cols":16},"hourly":{"offset":2176,"rows":720,"cols":23,"first_hour":2160}},{"file":"chunk_004.bin","t0":2880.0,"t1":3600.0,"bytes":68416,"sha256":"0f015352afddf23fa821db44aff041b7c4eaffcdc29997dda908bc78849e4890","segments":{"offset":0,"rows":34,"cols":16},"hourly":{"offset":2176,"rows":720,"cols":23,"first_hour":2880}},{"file":"chunk_005.bin","t0":3600.0,"t1":4320.0,"bytes":68416,"sha256":"8b5b6de6e96b902acb00941ccb5b306b5465451c5470221aa1715dccbab2e4b3","segments":{"offset":0,"rows":34,"cols":16},"hourly":{"offset":2176,"rows":720,"cols":23,"first_hour":3600}},{"file":"chunk_006.bin","t0":4320.0,"t1":5040.0,"bytes":68352,"sha256":"28e01cd7b3537b88c68a6dbcb834c9de639d0b2fc2182e9756feb86036e6c7eb","segments":{"offset":0,"rows":33,"cols":16},"hourly":{"offset":2112,"rows":720,"cols":23,"first_hour":4320}},{"file":"chunk_007.bin","t0":5040.0,"t1":5760.0,"bytes":68992,"sha256":"5fd55baf4353b75c168e85815940612a92f08a49bbe778f008c2e910c53ef829","segments":{"offset":0,"rows":43,"cols":16},"hourly":{"offset":2752,"rows":720,"cols":23,"first_hour":5040}},{"file":"chunk_008.bin","t0":5760.0,"t1":6480.0,"bytes":68928,"sha256":"fd18e74b2891137ac1430a28e03660ffaf2cd490e8d6fd06cfbb9dacc5692a55","segments":{"offset":0,"rows":42,"cols":16},"hourly":{"offset":2688,"rows":720,"cols":23,"first_hour":5760}},{"file":"chunk_009.bin","t0":6480.0,"t1":7200.0,"bytes":69760,"sha256":"c3da155e47d8f317cf48ae01352ecc92e3e1917e94d4a18de441d0800ca12343","segments":{"offset":0,"rows":55,"cols":16},"hourly":{"offset":3520,"rows":720,"cols":23,"first_hour":6480}},{"file":"chunk_010.bin","t0":7200.0,"t1":7920.0,"bytes":68096,"sha256":"99f4d40f16c5f416701a40eaa853aa40c2a505cbb53da5001852b48a8d2cf8ed","segments":{"offset":0,"rows":29,"cols":16},"hourly":{"offset":1856,"rows":720,"cols":23,"first_hour":7200}},{"file":"chunk_011.bin","t0":7920.0,"t1":8640.0,"bytes":68416,"sha256":"219963cec29c67e391ea31878970ebb319330991795746175a5ab4e3dad4c262","segments":{"offset":0,"rows":34,"cols":16},"hourly":{"offset":2176,"rows":720,"cols":23,"first_hour":7920}},{"file":"chunk_012.bin","t0":8640.0,"t1":8760.0,"bytes":11552,"sha256":"9ba47ff9d6c9a234217bc02357f7ccc9dad84c592864c8fc19c6d0b439ef99a8","segments":{"offset":0,"rows":8,"cols":16},"hourly":{"offset":512,"rows":120,"cols":23,"first_hour":8640}}],"landings":[{"t_h":824.5669060258969,"cls":"CLPS","pad":"PAD_A","miss_m":2.0096439983240812,"ok":true,"failure_kind":null,"cargo_kg":342.8,"trajectory":{"cls":"CLPS","pilot":"classical","pick":"p50","seed":100202,"miss_m":2.1538}},{"t_h":5099.7394359238615,"cls":"CLPS","pad":"PAD_A","miss_m":1.8564678828355745,"ok":true,"failure_kind":null,"cargo_kg":150.7,"trajectory":{"cls":"CLPS","pilot":"classical","pick":"p50","seed":100202,"miss_m":2.1538}},{"t_h":6434.89584634472,"cls":"MK1","pad":"PAD_A","miss_m":2.9236378024645937,"ok":true,"failure_kind":null,"cargo_kg":2706.0,"trajectory":{"cls":"MK1","pilot":"classical","pick":"p50","seed":100166,"miss_m":2.125}}],"keepout_windows":[[824.0669060258969,825.0669060258969,"PAD_A",1.0],[5099.2394359238615,5100.2394359238615,"PAD_A",1.0],[6434.39584634472,6435.39584634472,"PAD_A",1.0]],"nights":[[602.412,708.72],[1311.132,1417.44],[2019.852,2126.1600000000003],[2728.572,2834.88],[3437.292,3543.6],[4146.012,4252.32],[4854.732,4961.04],[5563.452,5669.76],[6272.172,6378.48],[6980.892,7087.2],[7689.612,7795.92],[8398.332,8504.640000000001],[9107.052,8760.0]],"deliveries":[[56.29,0,500.0,3,72.17],[149.73,0,500.0,3,1.29],[283.14,0,500.0,3,1.27],[451.94,0,500.0,3,1.27],[710.02,0,500.0,3,91.3],[797.91,0,500.0,3,1.29],[834.02,0,342.8,1,1.92],[845.79,0,500.0,3,1.3],[1044.99,0,500.0,3,1.3],[1217.33,0,500.0,3,20.68],[1291.51,0,500.0,3,7.77],[1462.65,0,500.0,3,75.43],[1470.84,7,97.9,3,1.63],[1676.64,0,500.0,3,1.51],[1723.84,0,500.0,3,1.27],[1872.13,0,500.0,3,1.29],[2127.45,0,500.0,3,26.26],[2203.74,0,500.0,3,1.31],[2334.77,0,500.0,3,2.96],[2523.19,0,500.0,3,1.29],[2560.72,0,500.0,3,1.29],[2836.17,0,500.0,3,31.95],[2902.94,0,500.0,3,1.3],[3007.63,0,500.0,3,1.37],[3236.72,0,500.0,3,1.29],[3422.27,0,500.0,3,1.28],[3544.88,0,500.0,3,83.63],[3670.26,0,500.0,3,1.27],[3802.41,0,500.0,3,35.88],[3978.59,0,500.0,3,1.29],[4125.03,0,500.0,3,4.59],[4256.12,0,500.0,3,63.19],[4447.22,0,500.0,3,19.06],[4550.3,0,500.0,3,1.28],[4726.13,0,500.0,3,27.44],[4962.31,0,500.0,3,97.58],[4963.59,0,500.0,3,10.02],[5117.31,1,150.7,1,7.72],[5149.02,0,500.0,3,1.25],[5312.55,0,500.0,3,1.29],[5345.24,0,500.0,3,1.3],[5671.04,0,500.0,3,71.97],[5679.77,0,500.0,3,1.26],[5838.32,0,500.0,3,1.29],[5935.62,0,500.0,3,1.26],[6162.24,0,500.0,3,1.27],[6378.51,0,500.0,3,130.88],[6458.85,1,1048.7,1,2.48],[6461.03,5,87.7,2,2.35],[6465.11,0,291.2,1,2.15],[6524.27,3,969.2,2,71.95],[6526.19,0,63.3,2,70.19],[6528.25,1,245.9,1,62.5],[6529.79,0,500.0,3,51.6],[6538.5,0,500.0,3,1.3],[6726.3,0,500.0,3,1.28],[6771.4,7,449.5,3,1.82],[6848.63,0,500.0,3,1.28],[7112.96,0,500.0,3,88.48],[7114.27,0,500.0,3,4.56],[7254.69,0,500.0,3,1.37],[7483.34,0,500.0,3,1.3],[7658.32,0,500.0,3,29.5],[7802.47,0,500.0,3,54.69],[7946.76,0,500.0,3,1.28],[7988.31,0,500.0,3,1.27],[8228.52,0,500.0,3,1.29],[8274.95,0,500.0,3,1.28],[8562.82,0,500.0,3,27.02],[8659.54,0,500.0,3,27.48]],"delivery_columns":["t_h","site","mass_kg","priority","wait_h"],"jobs":[[0,